{
  "$schema": "https://json-schema.org/draft/2020-12/schema",
  "title": "Hungarian patient triggers",
  "type": "array",
  "items": {
    "type": "object",
    "additionalProperties": false,
    "properties": {
      "id": {
        "type": "string",
        "pattern": "^pt_tr_[0-9]{3}$"
      },
      "ex": {
        "type": "array",
        "minItems": 3,
        "maxItems": 8,
        "items": {
          "type": "string",
          "minLength": 1,
          "maxLength": 200
        }
      },
      "m": {
        "type": "object",
        "additionalProperties": false,
        "properties": {
          "t": {
            "type": "string",
            "enum": [
              "exact",
              "regex",
              "intent",
              "entity",
              "sentiment",
              "hybrid"
            ]
          },
          "p": {
            "type": "string"
          },
          "i": {
            "type": "string"
          },
          "e": {
            "type": "array",
            "items": {
              "type": "string"
            }
          },
          "s": {
            "type": "string",
            "enum": [
              "neg",
              "pos",
              "neu"
            ]
          }
        },
        "required": [
          "t"
        ],
        "allOf": [
          {
            "if": {
              "properties": {
                "t": {
                  "const": "regex"
                }
              },
              "required": [
                "t"
              ]
            },
            "then": {
              "required": [
                "p"
              ]
            }
          },
          {
            "if": {
              "properties": {
                "t": {
                  "const": "exact"
                }
              },
              "required": [
                "t"
              ]
            },
            "then": {
              "required": [
                "p"
              ]
            }
          },
          {
            "if": {
              "properties": {
                "t": {
                  "const": "intent"
                }
              },
              "required": [
                "t"
              ]
            },
            "then": {
              "required": [
                "i"
              ]
            }
          }
        ]
      },
      "tags": {
        "type": "array",
        "minItems": 1,
        "items": {
          "type": "string",
          "minLength": 1
        }
      },
      "prio": {
        "type": "integer",
        "minimum": 1,
        "maximum": 5
      },
      "safety": {
        "type": "string",
        "enum": [
          "hard_handoff",
          "escalate",
          "monitor",
          "none"
        ]
      },
      "cat": {
        "type": "string",
        "enum": [
          "cri",
          "bd",
          "str",
          "emp",
          "oq",
          "cq",
          "var",
          "cbt",
          "edu",
          "enc",
          "clo",
          "cult"
        ]
      },
      "cand": {
        "type": "array",
        "minItems": 1,
        "items": {
          "type": "string",
          "minLength": 1
        }
      },
      "fb": {
        "type": "string",
        "enum": [
          "use_variant",
          "ask_clarifying",
          "call_llm",
          "escalate"
        ]
      },
      "ct": {
        "type": "object",
        "additionalProperties": false,
        "properties": {
          "m": {
            "type": "number",
            "minimum": 0,
            "maximum": 1
          },
          "r": {
            "type": "number",
            "minimum": 0,
            "maximum": 1
          }
        },
        "required": [
          "m",
          "r"
        ]
      },
      "cost": {
        "type": "object",
        "additionalProperties": false,
        "properties": {
          "stt_min": {
            "type": "number",
            "minimum": 0
          },
          "in_tok": {
            "type": "integer",
            "minimum": 0
          },
          "out_tok": {
            "type": "integer",
            "minimum": 0
          },
          "tts_ch": {
            "type": "integer",
            "minimum": 0
          }
        },
        "required": [
          "stt_min",
          "in_tok",
          "out_tok",
          "tts_ch"
        ]
      },
      "cult": {
        "type": "string"
      },
      "audit": {
        "type": "boolean"
      },
      "note": {
        "type": "string"
      },
      "age": {
        "type": "array",
        "minItems": 1,
        "items": {
          "type": "string",
          "enum": [
            "child",
            "teen",
            "adult",
            "senior"
          ]
        }
      },
      "lit": {
        "type": "string",
        "enum": [
          "low",
          "medium",
          "high"
        ]
      },
      "reg": {
        "type": "string",
        "enum": [
          "plain",
          "conversational",
          "clinical",
          "youth"
        ]
      },
      "persona": {
        "type": "array",
        "items": {
          "type": "string"
        }
      },
      "pref": {
        "type": "object",
        "additionalProperties": false,
        "properties": {
          "tts_speed": {
            "type": "string",
            "enum": [
              "slow",
              "normal",
              "fast"
            ]
          },
          "tts_voice": {
            "type": "string"
          },
          "prefer_text": {
            "type": "boolean"
          }
        }
      },
      "meta": {
        "type": "object",
        "additionalProperties": true,
        "properties": {
          "src": {
            "type": "string",
            "enum": ["dev", "sum", "trn", "aud", "llm", "lit", "mix"]
          },
          "status": {
            "type": "string",
            "enum": ["appr", "rev", "sugg", "test", "hold"]
          },
          "enabled_in": {
            "type": "array",
            "minItems": 1,
            "items": {
              "type": "string",
              "enum": ["rt", "rv", "tst"]
            }
          },
          "profile_id": {"type": "string"},
          "origin_ref": {"type": "string"}
        }
      }
    },
    "required": [
      "id",
      "ex",
      "m",
      "tags",
      "prio",
      "safety",
      "cat",
      "cand",
      "fb",
      "ct",
      "cost",
      "audit"
    ],
    "allOf": [
      {
        "if": {
          "properties": {
            "prio": {
              "const": 1
            },
            "safety": {
              "enum": [
                "hard_handoff",
                "escalate"
              ]
            }
          },
          "required": [
            "prio",
            "safety"
          ]
        },
        "then": {
          "properties": {
            "audit": {
              "const": true
            }
          },
          "required": [
            "audit"
          ]
        }
      }
    ]
  }
}
