[
  {
    "ex": [
      "Hogy fog menni ez",
      "Mondd el a menetét",
      "Mi lesz most a folyamat"
    ],
    "m": {
      "t": "regex",
      "p": "\\\\b(hogy fog menni ez|mondd el a menetét|mi lesz most a folyamat)\\\\b"
    },
    "tags": [
      "str",
      "process"
    ],
    "prio": 2,
    "safety": "none",
    "cat": "str",
    "cand": [
      "str_002",
      "str_009"
    ],
    "fb": "use_variant",
    "ct": {
      "m": 0.65,
      "r": 0.45
    },
    "cost": {
      "stt_min": 0.42,
      "in_tok": 170,
      "out_tok": 58,
      "tts_ch": 205
    },
    "audit": false,
    "age": [
      "teen",
      "adult",
      "senior"
    ],
    "lit": "medium",
    "reg": "plain",
    "pref": {
      "tts_speed": "slow"
    },
    "id": "pt_tr_029",
    "meta": {
      "src": "dev",
      "status": "rev",
      "enabled_in": [
        "rt",
        "rv",
        "tst"
      ]
    }
  },
  {
    "ex": [
      "Kevés időm van",
      "Mennyi időnk van",
      "Röviden haladjunk"
    ],
    "m": {
      "t": "regex",
      "p": "\\\\b(kevés időm van|mennyi időnk van|röviden haladjunk)\\\\b"
    },
    "tags": [
      "str",
      "time"
    ],
    "prio": 2,
    "safety": "none",
    "cat": "str",
    "cand": [
      "str_004",
      "str_011"
    ],
    "fb": "use_variant",
    "ct": {
      "m": 0.65,
      "r": 0.45
    },
    "cost": {
      "stt_min": 0.42,
      "in_tok": 170,
      "out_tok": 58,
      "tts_ch": 205
    },
    "audit": false,
    "age": [
      "teen",
      "adult",
      "senior"
    ],
    "lit": "medium",
    "reg": "plain",
    "pref": {
      "tts_speed": "slow"
    },
    "id": "pt_tr_030",
    "meta": {
      "src": "dev",
      "status": "rev",
      "enabled_in": [
        "rt",
        "rv",
        "tst"
      ]
    }
  },
  {
    "ex": [
      "Segíts fókuszt választani",
      "Mivel kezdjük",
      "Rakjunk sorrendet"
    ],
    "m": {
      "t": "regex",
      "p": "\\\\b(segíts fókuszt választani|mivel kezdjük|rakjunk sorrendet)\\\\b"
    },
    "tags": [
      "str",
      "agenda"
    ],
    "prio": 2,
    "safety": "none",
    "cat": "str",
    "cand": [
      "str_001",
      "str_007"
    ],
    "fb": "use_variant",
    "ct": {
      "m": 0.65,
      "r": 0.45
    },
    "cost": {
      "stt_min": 0.42,
      "in_tok": 170,
      "out_tok": 58,
      "tts_ch": 205
    },
    "audit": false,
    "age": [
      "teen",
      "adult",
      "senior"
    ],
    "lit": "medium",
    "reg": "plain",
    "pref": {
      "tts_speed": "slow"
    },
    "id": "pt_tr_031",
    "meta": {
      "src": "dev",
      "status": "rev",
      "enabled_in": [
        "rt",
        "rv",
        "tst"
      ]
    }
  },
  {
    "ex": [
      "A végén kérnék összefoglalót",
      "Záráskor mondd el a lényeget",
      "Kellene egy rövid összegzés"
    ],
    "m": {
      "t": "regex",
      "p": "\\\\b(a végén kérnék összefoglalót|záráskor mondd el a lényeget|kellene egy rövid összegzés)\\\\b"
    },
    "tags": [
      "str",
      "summary"
    ],
    "prio": 2,
    "safety": "none",
    "cat": "str",
    "cand": [
      "str_010",
      "str_015"
    ],
    "fb": "use_variant",
    "ct": {
      "m": 0.65,
      "r": 0.45
    },
    "cost": {
      "stt_min": 0.42,
      "in_tok": 170,
      "out_tok": 58,
      "tts_ch": 205
    },
    "audit": false,
    "age": [
      "teen",
      "adult",
      "senior"
    ],
    "lit": "medium",
    "reg": "plain",
    "pref": {
      "tts_speed": "slow"
    },
    "id": "pt_tr_032",
    "meta": {
      "src": "dev",
      "status": "rev",
      "enabled_in": [
        "rt",
        "rv",
        "tst"
      ]
    }
  }
]
