[
  {
    "ex": [
      "Fassen wir zusammen",
      "Lassen Sie uns kurz abschließen",
      "Worum geht es heute?"
    ],
    "m": {
      "t": "regex",
      "p": "(?:Fassen\\ wir\\ zusammen|Lassen\\ Sie\\ uns\\ kurz\\ abschließen|Worum\\ geht\\ es\\ heute\\?)"
    },
    "tags": [
      "clo",
      "summary"
    ],
    "prio": 2,
    "safety": "none",
    "cat": "clo",
    "cand": [
      "clo_001",
      "clo_002"
    ],
    "fb": "use_variant",
    "ct": {
      "m": 0.65,
      "r": 0.45
    },
    "cost": {
      "stt_min": 0.42,
      "in_tok": 170,
      "out_tok": 58,
      "tts_ch": 205
    },
    "audit": false,
    "age": [
      "teen",
      "adult",
      "senior"
    ],
    "lit": "low",
    "reg": "plain",
    "pref": {
      "tts_speed": "slow"
    },
    "id": "pt_tr_097",
    "meta": {
      "src": "dev",
      "status": "rev",
      "enabled_in": [
        "rt",
        "rv",
        "tst"
      ]
    }
  },
  {
    "ex": [
      "Was sollte der nächste Schritt sein?",
      "Warum sollte ich weitermachen?",
      "Geben Sie einen Abschlussplan an"
    ],
    "m": {
      "t": "regex",
      "p": "(?:Was\\ sollte\\ der\\ nächste\\ Schritt\\ sein\\?|Warum\\ sollte\\ ich\\ weitermachen\\?|Geben\\ Sie\\ einen\\ Abschlussplan\\ an)"
    },
    "tags": [
      "clo",
      "next_step"
    ],
    "prio": 2,
    "safety": "none",
    "cat": "clo",
    "cand": [
      "clo_003",
      "clo_010"
    ],
    "fb": "use_variant",
    "ct": {
      "m": 0.65,
      "r": 0.45
    },
    "cost": {
      "stt_min": 0.42,
      "in_tok": 170,
      "out_tok": 58,
      "tts_ch": 205
    },
    "audit": false,
    "age": [
      "teen",
      "adult",
      "senior"
    ],
    "lit": "low",
    "reg": "plain",
    "pref": {
      "tts_speed": "slow"
    },
    "id": "pt_tr_098",
    "meta": {
      "src": "dev",
      "status": "rev",
      "enabled_in": [
        "rt",
        "rv",
        "tst"
      ]
    }
  },
  {
    "ex": [
      "Abschließend möchte ich noch um eine Quelle bitten",
      "Gib mir etwas zum Reisen",
      "Vor dem Schließen sollte ein Handlauf vorhanden sein"
    ],
    "m": {
      "t": "regex",
      "p": "(?:Abschließend\\ möchte\\ ich\\ noch\\ um\\ eine\\ Quelle\\ bitten|Gib\\ mir\\ etwas\\ zum\\ Reisen|Vor\\ dem\\ Schließen\\ sollte\\ ein\\ Handlauf\\ vorhanden\\ sein)"
    },
    "tags": [
      "clo",
      "resource"
    ],
    "prio": 2,
    "safety": "none",
    "cat": "clo",
    "cand": [
      "clo_005",
      "clo_008"
    ],
    "fb": "use_variant",
    "ct": {
      "m": 0.65,
      "r": 0.45
    },
    "cost": {
      "stt_min": 0.42,
      "in_tok": 170,
      "out_tok": 58,
      "tts_ch": 205
    },
    "audit": false,
    "age": [
      "teen",
      "adult",
      "senior"
    ],
    "lit": "low",
    "reg": "plain",
    "pref": {
      "tts_speed": "slow"
    },
    "id": "pt_tr_099",
    "meta": {
      "src": "dev",
      "status": "rev",
      "enabled_in": [
        "rt",
        "rv",
        "tst"
      ]
    }
  },
  {
    "ex": [
      "Bevor wir schließen, werfen wir einen Blick auf die Sicherheit",
      "Fragen Sie am Ende, ob es mir gut geht",
      "Vor der Fertigstellung ist eine Sicherheitsüberprüfung erforderlich"
    ],
    "m": {
      "t": "regex",
      "p": "(?:Bevor\\ wir\\ schließen,\\ werfen\\ wir\\ einen\\ Blick\\ auf\\ die\\ Sicherheit|Fragen\\ Sie\\ am\\ Ende,\\ ob\\ es\\ mir\\ gut\\ geht|Vor\\ der\\ Fertigstellung\\ ist\\ eine\\ Sicherheitsüberprüfung\\ erforderlich)"
    },
    "tags": [
      "clo",
      "safety"
    ],
    "prio": 2,
    "safety": "monitor",
    "cat": "clo",
    "cand": [
      "clo_009",
      "clo_004"
    ],
    "fb": "ask_clarifying",
    "ct": {
      "m": 0.68,
      "r": 0.5
    },
    "cost": {
      "stt_min": 0.48,
      "in_tok": 190,
      "out_tok": 64,
      "tts_ch": 220
    },
    "audit": false,
    "age": [
      "teen",
      "adult",
      "senior"
    ],
    "lit": "low",
    "reg": "plain",
    "pref": {
      "tts_speed": "slow"
    },
    "id": "pt_tr_100",
    "meta": {
      "src": "dev",
      "status": "rev",
      "enabled_in": [
        "rt",
        "rv",
        "tst"
      ]
    }
  }
]
