[
  {
    "ex": [
      "Let's summarize",
      "Let's conclude briefly",
      "What's the point today"
    ],
    "m": {
      "t": "regex",
      "p": "(?:Let's\\ summarize|Let's\\ conclude\\ briefly|What's\\ the\\ point\\ today)"
    },
    "tags": [
      "clo",
      "summary"
    ],
    "prio": 2,
    "safety": "none",
    "cat": "clo",
    "cand": [
      "clo_001",
      "clo_002"
    ],
    "fb": "use_variant",
    "ct": {
      "m": 0.65,
      "r": 0.45
    },
    "cost": {
      "stt_min": 0.42,
      "in_tok": 170,
      "out_tok": 58,
      "tts_ch": 205
    },
    "audit": false,
    "age": [
      "teen",
      "adult",
      "senior"
    ],
    "lit": "low",
    "reg": "plain",
    "pref": {
      "tts_speed": "slow"
    },
    "id": "pt_tr_097",
    "meta": {
      "src": "dev",
      "status": "rev",
      "enabled_in": [
        "rt",
        "rv",
        "tst"
      ]
    }
  },
  {
    "ex": [
      "What should be the next step",
      "Why should I go on?",
      "Give a closing plan"
    ],
    "m": {
      "t": "regex",
      "p": "(?:What\\ should\\ be\\ the\\ next\\ step|Why\\ should\\ I\\ go\\ on\\?|Give\\ a\\ closing\\ plan)"
    },
    "tags": [
      "clo",
      "next_step"
    ],
    "prio": 2,
    "safety": "none",
    "cat": "clo",
    "cand": [
      "clo_003",
      "clo_010"
    ],
    "fb": "use_variant",
    "ct": {
      "m": 0.65,
      "r": 0.45
    },
    "cost": {
      "stt_min": 0.42,
      "in_tok": 170,
      "out_tok": 58,
      "tts_ch": 205
    },
    "audit": false,
    "age": [
      "teen",
      "adult",
      "senior"
    ],
    "lit": "low",
    "reg": "plain",
    "pref": {
      "tts_speed": "slow"
    },
    "id": "pt_tr_098",
    "meta": {
      "src": "dev",
      "status": "rev",
      "enabled_in": [
        "rt",
        "rv",
        "tst"
      ]
    }
  },
  {
    "ex": [
      "At the end, I would like to ask for a source",
      "Give me something to travel with",
      "There should be a handrail before closing"
    ],
    "m": {
      "t": "regex",
      "p": "(?:At\\ the\\ end,\\ I\\ would\\ like\\ to\\ ask\\ for\\ a\\ source|Give\\ me\\ something\\ to\\ travel\\ with|There\\ should\\ be\\ a\\ handrail\\ before\\ closing)"
    },
    "tags": [
      "clo",
      "resource"
    ],
    "prio": 2,
    "safety": "none",
    "cat": "clo",
    "cand": [
      "clo_005",
      "clo_008"
    ],
    "fb": "use_variant",
    "ct": {
      "m": 0.65,
      "r": 0.45
    },
    "cost": {
      "stt_min": 0.42,
      "in_tok": 170,
      "out_tok": 58,
      "tts_ch": 205
    },
    "audit": false,
    "age": [
      "teen",
      "adult",
      "senior"
    ],
    "lit": "low",
    "reg": "plain",
    "pref": {
      "tts_speed": "slow"
    },
    "id": "pt_tr_099",
    "meta": {
      "src": "dev",
      "status": "rev",
      "enabled_in": [
        "rt",
        "rv",
        "tst"
      ]
    }
  },
  {
    "ex": [
      "Before closing, let's look at security",
      "At closing, ask if I'll be okay",
      "A safety check is required before completion"
    ],
    "m": {
      "t": "regex",
      "p": "(?:Before\\ closing,\\ let's\\ look\\ at\\ security|At\\ closing,\\ ask\\ if\\ I'll\\ be\\ okay|A\\ safety\\ check\\ is\\ required\\ before\\ completion)"
    },
    "tags": [
      "clo",
      "safety"
    ],
    "prio": 2,
    "safety": "monitor",
    "cat": "clo",
    "cand": [
      "clo_009",
      "clo_004"
    ],
    "fb": "ask_clarifying",
    "ct": {
      "m": 0.68,
      "r": 0.5
    },
    "cost": {
      "stt_min": 0.48,
      "in_tok": 190,
      "out_tok": 64,
      "tts_ch": 220
    },
    "audit": false,
    "age": [
      "teen",
      "adult",
      "senior"
    ],
    "lit": "low",
    "reg": "plain",
    "pref": {
      "tts_speed": "slow"
    },
    "id": "pt_tr_100",
    "meta": {
      "src": "dev",
      "status": "rev",
      "enabled_in": [
        "rt",
        "rv",
        "tst"
      ]
    }
  }
]
