[
  {
    "ex": [
      "Miért nem tudok aludni",
      "Adj alvás tippet",
      "Az alvásom teljesen rossz"
    ],
    "m": {
      "t": "regex",
      "p": "\\\\b(miért nem tudok aludni|adj alvás tippet|alvásom teljesen rossz)\\\\b"
    },
    "tags": [
      "edu",
      "sleep"
    ],
    "prio": 2,
    "safety": "none",
    "cat": "edu",
    "cand": [
      "edu_004",
      "edu_005"
    ],
    "fb": "call_llm",
    "ct": {
      "m": 0.65,
      "r": 0.45
    },
    "cost": {
      "stt_min": 0.42,
      "in_tok": 170,
      "out_tok": 58,
      "tts_ch": 205
    },
    "audit": false,
    "age": [
      "adult",
      "senior"
    ],
    "lit": "low",
    "reg": "plain",
    "pref": {
      "tts_speed": "slow"
    },
    "id": "pt_tr_085",
    "meta": {
      "src": "dev",
      "status": "rev",
      "enabled_in": [
        "rt",
        "rv",
        "tst"
      ]
    }
  },
  {
    "ex": [
      "A fájdalom miatt szorongok",
      "Mit tudjak a stressz és fájdalom kapcsolatáról",
      "A testem is fáj ettől"
    ],
    "m": {
      "t": "regex",
      "p": "\\\\b(fájdalom miatt szorongok|stressz és fájdalom kapcsolatáról|testem is fáj ettől)\\\\b"
    },
    "tags": [
      "edu",
      "pain"
    ],
    "prio": 2,
    "safety": "monitor",
    "cat": "edu",
    "cand": [
      "edu_001",
      "edu_010"
    ],
    "fb": "call_llm",
    "ct": {
      "m": 0.68,
      "r": 0.5
    },
    "cost": {
      "stt_min": 0.48,
      "in_tok": 190,
      "out_tok": 64,
      "tts_ch": 220
    },
    "audit": false,
    "age": [
      "adult",
      "senior"
    ],
    "lit": "low",
    "reg": "plain",
    "pref": {
      "tts_speed": "slow"
    },
    "id": "pt_tr_086",
    "meta": {
      "src": "dev",
      "status": "rev",
      "enabled_in": [
        "rt",
        "rv",
        "tst"
      ]
    }
  },
  {
    "ex": [
      "Mondd el mi történik pániknál",
      "Mi a pánikroham mechanizmusa",
      "Érdekel a testi reakció"
    ],
    "m": {
      "t": "regex",
      "p": "\\\\b(mi történik pániknál|pánikroham mechanizmusa|érdekel a testi reakció)\\\\b"
    },
    "tags": [
      "edu",
      "panic"
    ],
    "prio": 2,
    "safety": "none",
    "cat": "edu",
    "cand": [
      "edu_002",
      "edu_003"
    ],
    "fb": "call_llm",
    "ct": {
      "m": 0.65,
      "r": 0.45
    },
    "cost": {
      "stt_min": 0.42,
      "in_tok": 170,
      "out_tok": 58,
      "tts_ch": 205
    },
    "audit": false,
    "age": [
      "adult",
      "senior"
    ],
    "lit": "low",
    "reg": "plain",
    "pref": {
      "tts_speed": "slow"
    },
    "id": "pt_tr_087",
    "meta": {
      "src": "dev",
      "status": "rev",
      "enabled_in": [
        "rt",
        "rv",
        "tst"
      ]
    }
  },
  {
    "ex": [
      "Magyarázd el a groundingot",
      "Mi az az 5 4 3 2 1",
      "Hogy működik a földelés"
    ],
    "m": {
      "t": "regex",
      "p": "\\\\b(magyarázd el a groundingot|mi az az 5 4 3 2 1|hogy működik a földelés)\\\\b"
    },
    "tags": [
      "edu",
      "grounding"
    ],
    "prio": 2,
    "safety": "none",
    "cat": "edu",
    "cand": [
      "edu_003",
      "edu_011"
    ],
    "fb": "call_llm",
    "ct": {
      "m": 0.65,
      "r": 0.45
    },
    "cost": {
      "stt_min": 0.42,
      "in_tok": 170,
      "out_tok": 58,
      "tts_ch": 205
    },
    "audit": false,
    "age": [
      "adult",
      "senior"
    ],
    "lit": "low",
    "reg": "plain",
    "pref": {
      "tts_speed": "slow"
    },
    "id": "pt_tr_088",
    "meta": {
      "src": "dev",
      "status": "rev",
      "enabled_in": [
        "rt",
        "rv",
        "tst"
      ]
    }
  },
  {
    "ex": [
      "Adj légzésmagyarázatot",
      "Miért segít a lassú légzés",
      "Légzőgyakorlat kell"
    ],
    "m": {
      "t": "regex",
      "p": "\\\\b(adj légzésmagyarázatot|miért segít a lassú légzés|légzőgyakorlat kell)\\\\b"
    },
    "tags": [
      "edu",
      "breathing"
    ],
    "prio": 2,
    "safety": "none",
    "cat": "edu",
    "cand": [
      "edu_002",
      "edu_012"
    ],
    "fb": "call_llm",
    "ct": {
      "m": 0.65,
      "r": 0.45
    },
    "cost": {
      "stt_min": 0.42,
      "in_tok": 170,
      "out_tok": 58,
      "tts_ch": 205
    },
    "audit": false,
    "age": [
      "adult",
      "senior"
    ],
    "lit": "low",
    "reg": "plain",
    "pref": {
      "tts_speed": "slow"
    },
    "id": "pt_tr_089",
    "meta": {
      "src": "dev",
      "status": "rev",
      "enabled_in": [
        "rt",
        "rv",
        "tst"
      ]
    }
  },
  {
    "ex": [
      "Mi a terápia lényege",
      "Mire jó ez a beszélgetés",
      "Mondd el röviden hogy segít a terápia"
    ],
    "m": {
      "t": "regex",
      "p": "\\\\b(mi a terápia lényege|mire jó ez a beszélgetés|hogy segít a terápia)\\\\b"
    },
    "tags": [
      "edu",
      "therapy"
    ],
    "prio": 2,
    "safety": "none",
    "cat": "edu",
    "cand": [
      "edu_001",
      "edu_013"
    ],
    "fb": "call_llm",
    "ct": {
      "m": 0.65,
      "r": 0.45
    },
    "cost": {
      "stt_min": 0.42,
      "in_tok": 170,
      "out_tok": 58,
      "tts_ch": 205
    },
    "audit": false,
    "age": [
      "adult",
      "senior"
    ],
    "lit": "low",
    "reg": "plain",
    "pref": {
      "tts_speed": "slow"
    },
    "id": "pt_tr_090",
    "meta": {
      "src": "dev",
      "status": "rev",
      "enabled_in": [
        "rt",
        "rv",
        "tst"
      ]
    }
  },
  {
    "ex": [
      "Miért reagál így a testem stresszben",
      "Mondd el a stressz körét",
      "Miért pörgök fel ennyire"
    ],
    "m": {
      "t": "regex",
      "p": "\\\\b(testem stresszben|stressz körét|miért pörgök fel ennyire)\\\\b"
    },
    "tags": [
      "edu",
      "stress"
    ],
    "prio": 2,
    "safety": "none",
    "cat": "edu",
    "cand": [
      "edu_001",
      "edu_014"
    ],
    "fb": "call_llm",
    "ct": {
      "m": 0.65,
      "r": 0.45
    },
    "cost": {
      "stt_min": 0.42,
      "in_tok": 170,
      "out_tok": 58,
      "tts_ch": 205
    },
    "audit": false,
    "age": [
      "adult",
      "senior"
    ],
    "lit": "low",
    "reg": "plain",
    "pref": {
      "tts_speed": "slow"
    },
    "id": "pt_tr_091",
    "meta": {
      "src": "dev",
      "status": "rev",
      "enabled_in": [
        "rt",
        "rv",
        "tst"
      ]
    }
  },
  {
    "ex": [
      "Adj rövid önsegítő magyarázatot",
      "Olyan infó kell amit otthon használhatok",
      "Pszichoedukációt kérek röviden"
    ],
    "m": {
      "t": "regex",
      "p": "\\\\b(rövid önsegítő magyarázatot|otthon használhatok|pszichoedukációt kérek röviden)\\\\b"
    },
    "tags": [
      "edu",
      "coping"
    ],
    "prio": 2,
    "safety": "none",
    "cat": "edu",
    "cand": [
      "edu_001",
      "edu_015"
    ],
    "fb": "call_llm",
    "ct": {
      "m": 0.65,
      "r": 0.45
    },
    "cost": {
      "stt_min": 0.42,
      "in_tok": 170,
      "out_tok": 58,
      "tts_ch": 205
    },
    "audit": false,
    "age": [
      "adult",
      "senior"
    ],
    "lit": "low",
    "reg": "plain",
    "pref": {
      "tts_speed": "slow"
    },
    "id": "pt_tr_092",
    "meta": {
      "src": "dev",
      "status": "rev",
      "enabled_in": [
        "rt",
        "rv",
        "tst"
      ]
    }
  }
]
